{
  "id": "run:example-company:002",
  "company_id": "company:example-company",
  "base_snapshot_id": "snapshot:example-company:001",
  "started_at": "2026-03-10T11:58:00+00:00",
  "completed_at": "2026-03-10T12:00:00+00:00",
  "mode": "incremental",
  "model": "fixture-distiller-v1",
  "prompt_version": "company-distiller-v2",
  "input_digest": "sha256:dc5c102658390d77aac5ffe9e4236b698f95d755cf4e05b4d6e203375c479181",
  "connector_cursors": {
    "public": "2026-03-10",
    "crm": "cursor-001",
    "interview": "interview-001"
  },
  "status": "completed",
  "result_snapshot_id": "snapshot:example-company:002"
}
