{
  "id": "run:byd:001",
  "company_id": "company:byd",
  "base_snapshot_id": null,
  "started_at": "2026-08-16T09:00:00+08:00",
  "completed_at": "2026-08-16T09:05:00+08:00",
  "mode": "initial",
  "model": "openai-codex-agent",
  "prompt_version": "company-distiller-v2",
  "input_digest": "sha256:e64a1682b121699acd790c5557cd85005ca039f2c0217f06a8865ee5de2b1afa",
  "connector_cursors": {
    "hkex": "2026032703008",
    "byd-web": "snapshot-2026-08-16"
  },
  "status": "completed",
  "result_snapshot_id": "snapshot:byd:001"
}
