{
  "id": "run:byd:002",
  "company_id": "company:byd",
  "base_snapshot_id": "snapshot:byd:001",
  "started_at": "2026-08-16T09:10:00+08:00",
  "completed_at": "2026-08-16T09:15:00+08:00",
  "mode": "incremental",
  "model": "openai-codex-agent",
  "prompt_version": "company-distiller-v2",
  "input_digest": "sha256:14076a411fe3178926ed109d1f4ef3bad6dc5851326b0c0529ec4e033bf11211",
  "connector_cursors": {
    "hkex": "2026080200027"
  },
  "status": "completed",
  "result_snapshot_id": "snapshot:byd:002"
}
